{
  "schema_version": 1,
  "attempt_id": "11111111-1111-4111-8111-111111111111",
  "sha": "aaaaaaaaaaaaaaaaaaaaaaaaaaaaaaaaaaaaaaaa",
  "form": "inputs",
  "creation_boot_id": "22222222-2222-4222-8222-222222222222",
  "recovery_boot_id": null,
  "state": "prepared",
  "stage": null,
  "completed_stages": [],
  "predecessor_evidence_sha256": null,
  "pre_f4_sha256": null,
  "final_gate_staging_claim_id": null,
  "final_gate_staging_state": null,
  "staged_f4_sha256": null,
  "staged_outcome_sha256": null,
  "controller_lease_path": "/tmp/clinic/attempt/final-wave-controller.lease",
  "controller_lease_identity": {"device": 1, "inode": 200, "mode": 384, "uid": 1000, "gid": 1000, "link_count": 1},
  "controller_lease_state": "held",
  "controller_owners": [{"sequence": 1, "boot_id": "22222222-2222-4222-8222-222222222222", "pid": 2000, "start_ticks": 6000, "acquired_at_utc": "2026-07-16T12:00:00.000000Z", "relinquished_at_utc": null, "relinquish_kind": null}],
  "child_argv_sha256": "bbbbbbbbbbbbbbbbbbbbbbbbbbbbbbbbbbbbbbbbbbbbbbbbbbbbbbbbbbbbbbbb",
  "started_at_utc": null,
  "child_pid": null,
  "child_pgid": null,
  "child_start_ticks": null,
  "child_barrier_released": null,
  "termination_kind": null,
  "boot_disappearance_sha256": null,
  "wait_exit_code": null,
  "wait_signal": null,
  "timed_out": false,
  "typed_outcome_sha256": null,
  "cleanup_verified": false,
  "updated_at_utc": "2026-07-16T12:00:00.000000Z"
}
